[
  {
    "schema_version": 1,
    "id": "krokhol-disc-golf-course",
    "slug": "krokhol-disc-golf-course",
    "name": "Krokhol Disc Golf Course",
    "status": "active",
    "location": {
      "locality": "Siggerud",
      "municipality": "Nordre Follo",
      "county": "Akershus",
      "country": "Norge",
      "latitude": 59.80289655805656,
      "longitude": 10.926047017006706,
      "coordinate_precision": "course_center"
    },
    "summary": "Krokhol er et dedikert diskgolfanlegg ved Siggerud med krevende skogshull, åpne lengdehull, vann og tydelige høydeforskjeller.",
    "holes": 18,
    "course_type": "Dedikert diskgolfbane på golfbaneområde",
    "terrain": [
      "Skog",
      "Åpne partier",
      "Vannhull",
      "Store høydeforskjeller"
    ],
    "access": {
      "fee": "Gratis hverdager før kl. 11 og helge-/helligdager etter kl. 17; ellers 50 kr på hverdager og 80 kr i helger/helligdager",
      "season": "Sesongstyrt; kontroller baneåpning på den offisielle siden",
      "opening_hours": null,
      "booking_required": true,
      "notes": "Alle runder må bookes i UDisc, også i gratisperiodene."
    },
    "facilities": {
      "parking": true,
      "toilet": true,
      "practice_basket": null,
      "other": [
        "Kafé i sesong",
        "Proshop"
      ]
    },
    "suitability": {
      "difficulty": "Svært krevende",
      "beginner_friendly": false,
      "family_friendly": null,
      "good_for": [
        "viderekomne",
        "turneringsspillere",
        "banetur"
      ],
      "assessment_basis": "Operatøren beskriver en krevende layout med vann, høydeforskjeller, tette skogshull og åpne lange hull. UDisc klassifiserer banen som svært krevende."
    },
    "links": {
      "official_url": "https://krokholdgc.no/",
      "club_url": null,
      "map_url": "https://www.google.com/maps/search/?api=1&query=59.80289655805656%2C10.926047017006706",
      "external_course_url": "https://udisc.com/courses/krokhol-disc-golf-course-TKtF",
      "external_course_provider": "UDisc"
    },
    "sources": [
      {
        "id": "source_krokhol_official",
        "source_name": "Krokhol Disc Golf Course",
        "source_url": "https://krokholdgc.no/",
        "publisher": "Krokhol Disc Golf Course",
        "source_type": "official_course",
        "license": "Offentlig nettside; manuell faktakontroll, ingen kopiering",
        "checked_at": "2026-09-28",
        "automation_allowed": false,
        "qualification": "primary"
      },
      {
        "id": "source_krokhol_booking",
        "source_name": "Booking Info",
        "source_url": "https://krokholdgc.no/booking-info",
        "publisher": "Krokhol Disc Golf Course",
        "source_type": "operator",
        "license": "Offentlig nettside; manuell faktakontroll, ingen kopiering",
        "checked_at": "2026-09-28",
        "automation_allowed": false,
        "qualification": "primary"
      },
      {
        "id": "source_krokhol_udisc",
        "source_name": "UDisc baneoversikt",
        "source_url": "https://udisc.com/courses/krokhol-disc-golf-course-TKtF",
        "publisher": "UDisc",
        "source_type": "third_party_course_directory",
        "license": "Proprietær; manuell sekundærkontroll og ekstern lenke",
        "checked_at": "2026-09-28",
        "automation_allowed": false,
        "qualification": "manual_secondary"
      }
    ],
    "field_sources": {
      "name": [
        "source_krokhol_official"
      ],
      "location": [
        "source_krokhol_official",
        "source_krokhol_udisc"
      ],
      "status": [
        "source_krokhol_booking",
        "source_krokhol_udisc"
      ],
      "holes": [
        "source_krokhol_udisc"
      ],
      "course_type": [
        "source_krokhol_official",
        "source_krokhol_udisc"
      ],
      "terrain": [
        "source_krokhol_official"
      ],
      "access.fee": [
        "source_krokhol_booking"
      ],
      "access.season": [
        "source_krokhol_official",
        "source_krokhol_booking"
      ],
      "access.booking_required": [
        "source_krokhol_booking"
      ],
      "facilities.parking": [
        "source_krokhol_udisc"
      ],
      "facilities.toilet": [
        "source_krokhol_udisc"
      ],
      "facilities.other": [
        "source_krokhol_official"
      ],
      "suitability.difficulty": [
        "source_krokhol_official",
        "source_krokhol_udisc"
      ],
      "suitability.beginner_friendly": [
        "source_krokhol_official",
        "source_krokhol_udisc"
      ],
      "links.official_url": [
        "source_krokhol_official"
      ]
    },
    "editorial": {
      "legacy": true,
      "publication_status": "published_legacy",
      "data_quality_status": "legacy_incomplete",
      "source_checked_at": "2026-09-28",
      "content_last_updated_at": "2026-06-03",
      "notes": "23C-pilot: faktagrunnlaget er kontrollert. Koordinatet er UDisc sitt baneplasspunkt og er registrert som course_center, ikke som første tee. Publisert HTML er ikke oppdatert i denne fasen."
    }
  },
  {
    "schema_version": 1,
    "id": "klemetsrud-diskgolfbane",
    "slug": "klemetsrud-diskgolfbane",
    "name": "Klemetsrud diskgolfbane",
    "status": "active",
    "location": {
      "locality": "Oslo",
      "municipality": "Oslo",
      "county": "Oslo",
      "country": "Norge",
      "latitude": 59.83211054150041,
      "longitude": 10.858167457214478,
      "coordinate_precision": "course_center"
    },
    "summary": "Klemetsrud er en teknisk skogsbane i Klemetsrud idrettspark med 18 hull og tydelig klubbdrift.",
    "holes": 18,
    "course_type": "Skogsbane",
    "terrain": [
      "Skog",
      "Tydelige fairwayer",
      "Store høydeforskjeller"
    ],
    "access": {
      "fee": "Gratis; frivillig bidrag til vedlikehold",
      "season": "Hovedsesong sommer; UDisc oppgir at banen ikke er tilgjengelig i vintersesongen",
      "opening_hours": null,
      "booking_required": null,
      "notes": "Ukesgolf og arrangementer kan begrense casual spill; kontroller oppdatert baneinformasjon."
    },
    "facilities": {
      "parking": null,
      "toilet": "Kun ved turneringer og ukesgolf ifølge UDisc",
      "practice_basket": null,
      "other": [
        "Disker kan lånes fra BUA Mortensrud"
      ]
    },
    "suitability": {
      "difficulty": "Svært krevende",
      "beginner_friendly": false,
      "family_friendly": null,
      "good_for": [
        "viderekomne",
        "teknisk trening",
        "lokale spillere"
      ],
      "assessment_basis": "Klubben beskriver Elgtråkket som en skogsbane. UDisc oppgir store høydeforskjeller, lange tekniske hull og svært krevende vanskelighetsgrad."
    },
    "links": {
      "official_url": "https://www.klemetsrudil.no/diskgolf/",
      "club_url": "https://www.klemetsrudil.no/",
      "map_url": "https://www.google.com/maps/search/?api=1&query=59.83211054150041%2C10.858167457214478",
      "external_course_url": "https://udisc.com/courses/klemetsrud-diskgolfbane-qVbT",
      "external_course_provider": "UDisc"
    },
    "sources": [
      {
        "id": "source_klemetsrud_club",
        "source_name": "Klemetsrud diskgolf",
        "source_url": "https://www.klemetsrudil.no/diskgolf/",
        "publisher": "Klemetsrud idrettslag",
        "source_type": "club",
        "license": "Offentlig nettside; manuell faktakontroll, ingen kopiering",
        "checked_at": "2026-09-28",
        "automation_allowed": false,
        "qualification": "primary"
      },
      {
        "id": "source_klemetsrud_udisc",
        "source_name": "UDisc baneoversikt",
        "source_url": "https://udisc.com/courses/klemetsrud-diskgolfbane-qVbT",
        "publisher": "UDisc",
        "source_type": "third_party_course_directory",
        "license": "Proprietær; manuell sekundærkontroll og ekstern lenke",
        "checked_at": "2026-09-28",
        "automation_allowed": false,
        "qualification": "manual_secondary"
      }
    ],
    "field_sources": {
      "name": [
        "source_klemetsrud_club"
      ],
      "location": [
        "source_klemetsrud_club",
        "source_klemetsrud_udisc"
      ],
      "status": [
        "source_klemetsrud_club",
        "source_klemetsrud_udisc"
      ],
      "holes": [
        "source_klemetsrud_club",
        "source_klemetsrud_udisc"
      ],
      "course_type": [
        "source_klemetsrud_club",
        "source_klemetsrud_udisc"
      ],
      "terrain": [
        "source_klemetsrud_club",
        "source_klemetsrud_udisc"
      ],
      "access.fee": [
        "source_klemetsrud_club",
        "source_klemetsrud_udisc"
      ],
      "access.season": [
        "source_klemetsrud_club",
        "source_klemetsrud_udisc"
      ],
      "facilities.toilet": [
        "source_klemetsrud_udisc"
      ],
      "facilities.other": [
        "source_klemetsrud_club"
      ],
      "suitability.difficulty": [
        "source_klemetsrud_udisc"
      ],
      "suitability.beginner_friendly": [
        "source_klemetsrud_club",
        "source_klemetsrud_udisc"
      ],
      "links.official_url": [
        "source_klemetsrud_club"
      ],
      "links.club_url": [
        "source_klemetsrud_club"
      ]
    },
    "editorial": {
      "legacy": true,
      "publication_status": "published_legacy",
      "data_quality_status": "legacy_incomplete",
      "source_checked_at": "2026-09-28",
      "content_last_updated_at": "2026-06-03",
      "notes": "23C-pilot: klubbens 2026-banekart bekrefter aktiv drift. Koordinatet er UDisc sitt baneplasspunkt og er registrert som course_center. Publisert HTML er ikke oppdatert."
    }
  },
  {
    "schema_version": 1,
    "id": "holmenkollen-discgolfpark",
    "slug": "holmenkollen-discgolfpark",
    "name": "Holmenkollen DiscGolfpark",
    "status": "unknown",
    "location": {
      "locality": "Oslo",
      "municipality": "Oslo",
      "county": "Oslo",
      "country": "Norge",